{
  "schema_version": 1,
  "type": "architecture",
  "meta": {
    "title": "RAG 知识入库链路",
    "caption": "图 5-3 · 知识入库链路（实测 108 篇 → 243 条入库，质量门禁拦截 12 篇）",
    "locale": "zh-CN",
    "viewBox": [800, 500]
  },
  "groups": [
    { "id": "access-layer", "label": "接入层", "role": "interaction" },
    { "id": "write-layer", "label": "写入层", "role": "capability" }
  ],
  "nodes": [
    { "id": "src-csv", "label": "CsvProductLoader", "sublabel": "product.csv", "role": "capability", "group": "access-layer" },
    { "id": "src-md", "label": "MarkdownLoader", "sublabel": "docs/*.md", "role": "capability", "group": "access-layer" },
    { "id": "loader", "label": "DocLoader", "sublabel": "统一文档对象", "role": "neutral", "group": "access-layer" },
    { "id": "classifier", "label": "ContentClassifier", "sublabel": "内容分类器", "role": "control", "group": "access-layer" },
    { "id": "chunker", "label": "SemanticChunker", "sublabel": "语义分片", "role": "capability", "group": "access-layer" },
    { "id": "gate", "label": "QualityGate", "sublabel": "质量门禁·拦截", "role": "warn", "group": "access-layer" },
    { "id": "quarantine", "label": "Quarantine", "sublabel": "待人工复核", "role": "neutral", "group": "access-layer" },
    { "id": "dual-write", "label": "DualWriter", "sublabel": "双库写入", "role": "interaction", "group": "write-layer" },
    { "id": "milvus", "label": "Milvus", "sublabel": "向量库", "role": "capability", "group": "write-layer" },
    { "id": "elasticsearch", "label": "Elasticsearch", "sublabel": "关键词索引", "role": "capability", "group": "write-layer" }
  ],
  "edges": [
    { "from": "src-csv", "to": "loader", "label": "读取", "kind": "data" },
    { "from": "src-md", "to": "loader", "label": "读取", "kind": "data" },
    { "from": "loader", "to": "classifier", "label": "文档对象", "kind": "sync" },
    { "from": "classifier", "to": "chunker", "label": "分类结果", "kind": "sync" },
    { "from": "chunker", "to": "gate", "label": "分片", "kind": "sync" },
    { "from": "gate", "to": "dual-write", "label": "通过", "kind": "sync" },
    { "from": "gate", "to": "quarantine", "label": "拦截 12 篇", "kind": "async" },
    { "from": "dual-write", "to": "milvus", "label": "向量", "kind": "data" },
    { "from": "dual-write", "to": "elasticsearch", "label": "索引", "kind": "data" }
  ]
}
